167,Spring Natural Vegetarian Restaurant 春天素食餐廳,"Using natural organic materials, ""Spring Natural Vegetarian Restaurant"" offers cuisines by buffet and open kitchen style, and gives vegetarian cuisine a new look. Specialties like ""Fried Bearded Tooth Mushroom with Wine, Sesame Oil, and Soy Bean"", simulated ""Shark’s Fin"", ""King Oyster Mushroom"", and ""Fried Dumpling"" etc, more than a hundred delicacies are provided in Spring Natural Vegetarian Restaurant. Even the non-vegetarians and foreigners will be touched first and then praise profusely when they are dining here.
Lunch 11:45-14:00,Tea-time 14:30-16:30,Dinner 17:45-21:30,Holiday 11:30-14:00/17:30-21:30","3F., No.177, Sec. 1, Heping E. Rd., Da'an Dist., Taipei City Taiwan, R.O.C",Taipower Building,https://www.travel.taipei/en/gourmet/details/686,
168,Jinpolo Bakery 金波羅香華餅家,"Mon-Fri, 7:30AM-10:30PM; weekend 8:00AM-9:00PM","No. 254, Section 5, Nanjing East Rd., Songshan Dist., Taipei City Taiwan, R.O.C",Nanjing Sanmin,https://www.travel.taipei/en/gourmet/details/688,
169,Beiping Gardens 北平田園餡餅粥,"Serving distinctive and chewy Northern Chinese cuisine, Beiping Gardens is a constant award-winner at the Taipei International Beef Noodles Festival and also a nominee for the City’s Top 10 Popular Restaurants. For three decades, it has attracted government workers around Chongqing South Road with an authentic menu.
 
 Those who love chunky meat will surely be impressed by the chewy yellow beef, with tendons steeped in broth, at the ever-crowded Beiping Gardens. With reasonable prices, this long-established restaurant offers a variety of handmade, traditional Northern Chinese delicacies, such as its signature “Tomato & Beef Noodles” that combines handmade noodles with chunky tendons. The other menu highlights include: vegetarian stuffed pancakes, pancakes sumptuously stuffed with gigantic scallions and beef, exclusive pork dumplings, and millet congee; each delicious dish is full of surprises.
Opening Hours: Mon-Sun 11:00AM-2:00PM; 5:00PM-8:00PM","No. 1, Lane 5, Section 1, Chongqing South Rd., Zhongzheng Dist., Taipei City Taiwan, R.O.C",Taipei Main Station,https://www.travel.taipei/en/gourmet/details/679,
170,Grand Formosa-Brasserie 晶華酒店-柏麗廳,"Located on the first floor of the Grand Formosa Regent Taipei, this buffet style restaurant brings together creative cuisine from around the world. Scrumptious Chinese, western and Japanese dishes vie for your attention, presenting a truly global feast.
Breakfast - 6:30am to 10:00am
Lunch - 11:30am to 2:00pm
Afternoon tea - 2:30pm to 4:30pm
Dinner - 5:30pm to 9:30pm","No. 41, Sec. 2, Zhongshan N. Rd., Zhongshan Dist., Taipei City Taiwan, R.O.C",Zhongshan,https://www.travel.taipei/en/gourmet/details/698,
171,Kenting Dan Dan Bubble Milk Tea 墾丁蛋蛋ㄉㄨㄞ奶,"Standing on a busy street corner near National Taiwan University, Kenting Dan Dan Bubble Milk Tea draws much attention with its funny store name as well as youthful decorative details, including the walls covered in black spots reminiscent of cows. Such creative ideas helped to make it a most distinctive brand image.
 
 Although its competitors mushroomed during the “Pearl Milk Tea craze”, Kenting Dan Dan adopted brown sugar and fresh milk in its recipe, knowing that only those dare to innovate will survive. Rich in calcium, iron and minerals, the low-calorie brown sugar is now a popular beverage ingredient, and the fresh milk provides a natural, tasty source of nutrition. The best-sellers at Kenting Dan Dan not only quench the summer thirst with herbal jelly, mung beans and red beans, but they also ensure good health.
Opening Hours: Sun-Thu, 11:30AM-10:30PM; Fri-Sat 11:30AM-11:30PM","No. 165, Section 3, Tingzhou Rd., Zhongzheng Dist., Taipei City Taiwan, R.O.C",Gongguan,https://www.travel.taipei/en/gourmet/details/682,
172,Chengzhong Beef Ramen King 城中牛肉拉麵大王,"Sichuan-style stewed beef ramen and spicy beef ramen are the best sellers at this long-time establishment. Big servings and low prices have won the shop a loyal clientele, so empty seats are generally hard to find. The spicy beef ramen, made with Chinese cabbage and a sweet, peppery flavor, is a particular favorite of female patrons.
1.Daily 10:00 to 20:00
2.Closed: First four days of the Lunar New Yea","No. 7, Lane 46, Sec. 1, Chongcing S. Rd., Zhongzheng Dist., Taipei City Taiwan, R.O.C",Ximen,https://www.travel.taipei/en/gourmet/details/695,
173,Balsamo D'Oro 孚羅起士蛋糕咖啡,"A lot of loving care has gone into the sweets and caffeinated pleasures at Balsamo D'Oro. Apart from Italian coffee, the café specialty is cheesecake. Made with high-grade Australian cream cheese, the house cheesecake has a rich flavor and mouth-melting texture that are hard to beat.
Tue:12:00-18:30
Wed~Sat: 12:00-21:00
Sun: 12:00-18:30","No. 21, Lane 281, Longjiang Rd., Zhongshan Dist., Taipei City Taiwan, R.O.C",Zhongshan Junior High School,https://www.travel.taipei/en/gourmet/details/694,
174,Astoria Confectionary & Café 明星西點,,"No.7, Sec. 1, Wuchang St., Zhongzheng Dist., Taipei City Taiwan, R.O.C",NTU Hospital,https://www.travel.taipei/en/gourmet/details/714,
175,Yun-cheng Thai and Myanmar Cuisine 雲城泰緬美食,"The affordable price and nice service are the main features of this restaurant. It emphasizes the original hometown flavor. Specifically, the Myanmar shrimp sauce is hand-made by complex process and inductive so recommended badly.
Mon~Sun AM11:30~14:00、PM17:00~22:00","No. 2, Lane 231, Fuxing N. Rd., Songshan Dist., Taipei City Taiwan, R.O.C",Zhongshan Junior High School,https://www.travel.taipei/en/gourmet/details/666,
176,Jason's Fruits 陳記百果園,"Opening Hours: Mon-Fri, 7:00AM-7:00PM; Sat 7:00AM-2:00PM; closed on Sundays","No. 2, Alley 7, Lane 100, Section 1, Dunhua South Rd., Songshan Dist., Taipei City Taiwan, R.O.C",Zhongxiao Dunhua,https://www.travel.taipei/en/gourmet/details/689,
177,Rong Rong Yuan Restaurant 榮榮園浙寧餐廳,"Huang Cheng Lang, the chef of Rong Rong Yuan Restaurant, is one of our national top chefs of Zhejiang and Jiangsu cuisines. He is an expert in braised fish and meat cuisines due to decades of cooking experience. ""Roast Pork Chop"", ""Braised Fish Chin"", and ""Plain Sliced Spreading Chicken"" are foodies’ favorite classic dishes; and the traditional ""Braised Large Meatballs with Soy Sauce"", “Pork Aspic”, “Braised Tilefishes with Tofu”, and “Fried Eel” can furthermore satisfy all customers dining in Rong Rong Yuan.
Daily am11:30-14:00,17:00-21:00","No.25, Sec. 4, Xinyi Rd., Da'an Dist., Taipei City Taiwan, R.O.C",Daan,https://www.travel.taipei/en/gourmet/details/681,
178,Longdu Ice Dessert Parlor 龍都冰菓專業家,"Opening Hours: Mon-Sun. 11:30AM-1:00AM
closed at irregular intervals","No. 168, Guangzhou St., Wanhua Dist., Taipei City Taiwan, R.O.C",Longshan Temple,https://www.travel.taipei/en/gourmet/details/696,
179,"The Dragon, Sheraton Taipei Hotel 臺北喜來登飯店-辰園","""The Dragon"" in Sheraton Taipei Hotel is a Cantonese style restaurant which provides classic Cantonese dishes, Hong Kong Dim Sum, and various kinds of succulent seafood.
 
 Delicate ""Braised Pork with BBQ Sauce"", the pagoda shape side pork with tender and smooth taste, is using deep-fry and complex stew skills. Besides, ""Crispy Barbecue Pork"", ""Cured Meat and Clay-Pot-Cooked Rice"", and monthly changed chef’s specially recommendation can all represent The Dragon’s enthusiasm of cuisine.
Daily11:30-14:30、18:00-22:00","B1, No.12, Sec. 1, Zhongxiao E. Rd., Zhongzheng Dist., Taipei City Taiwan, R.O.C",Shandao Temple,https://www.travel.taipei/en/gourmet/details/691,
180,Zhanlu Coffee 湛盧咖啡,"Daily 12:00-22:00
Zhanlu has a variety of coffees depending on its origins, like Island coffee, African coffee, Asian coffee or American coffee; Italian coffees like espresso, mocha chocolate; various liquor coffee mixes like Bailey’s Irish cream coffee, Orange Wine coffee, Galliano Vanilla Coffee, Irish Whiskey Coffee; Iced mixed coffees like English Blend Iced Coffee, French Lavender Iced Coffee, Athens Violet Iced Coffee, etc. They also serve teas, drinks and desserts. 
Aside from serving delicious coffees, JEANLOOK Coffee, with its beautiful lighting and atmosphere, also hold lectures and free activities. Visitors are welcome to attend and learn things related to coffee.","No.2-1, Ln. 161, Sec. 1, Xinsheng S. Rd., Da'an Dist., Taipei City Taiwan, R.O.C",Daan Park,https://www.travel.taipei/en/gourmet/details/699,
181,Chang Nai-miao Memorial Hall 張迺妙茶師紀念館,"Chang Nai-miao was a pioneer tea farmer who had been rewarded by a Japanese governor, he taught residents Baozhong tea planting and imported Tieguanyin in Muzha. Now Chang Nai-miao Memorial Hall is located on the hills.
09:00 - 17:00 (Tue ~ Sun)","No. 53-2, Lane 34, Sec. 3, Zhinan Rd., Wenshan Dist., Taipei City Taiwan, R.O.C",,https://www.travel.taipei/en/gourmet/details/720,
182,Da Sheng Gong Beef Noodle Shop 大聲公牛肉麵,"Also known as ""NTU Beef Noodle Shop,"" this long-time establishment was one of the top-10 picks in an online poll of beef noodle shops in Taipei. The handmade noodles and broth have earned rave reviews, making this a popular haunt for the local student crowd. Among the menu favorites here are the clear broth beef noodles, beef noodles with tendon beef, and half-tendon, half-meat beef noodles. If beef noodles aren't your thing, you can also try the shop's chewy noodles with soybean paste and boiled dumplings.
Daily 11:00 to 15:00, 17:00 to 22:00","1F, No. 54-6, Sec. 3, Xinsheng S. Rd., Da'an Dist., Taipei City Taiwan, R.O.C",Taipower Building,https://www.travel.taipei/en/gourmet/details/703,
183,Brother Hotel (Plum Blossom Room) 兄弟大飯店-梅花廳,"The Plum Blossom Room of Brother Hotel, a Cantonese restaurant, attracts a loyal customer base and tourists that leave it packed during business hours.
 
 Served on pushcarts in a genuine style of Cantonese High Tea, the colorful dim sum options available at Plum Blossom Room include shrimp dumplings, seafood rolls and crab roe shumai. Among the best-sellers are deep-fried shrimp rolls, rice noodle rolls, roasted cabbage, and juicy seafood-stuffed buns, a must-try.
 
 For those planning to throw banquets, engagement parties, or wedding receptions, the restaurant offers Taiwan abalone with scallops, crab and shark fin stew, lobster, and various other dishes for any desired menu combination.
Daily 09:00-21:30 (dessert available till 20:30)","2F., No. 255, Sec. 3, Nanjing E. Rd., Songshan Dist., Taipei City Taiwan, R.O.C",Nanjing Fuxing,https://www.travel.taipei/en/gourmet/details/712,
184,The Sweet Dynasty 糖朝(統領概念旗艦店),"Mon-Fri AM11:00-AM02:00
Sat-Sun AM10:00-AM02:00 (holidays)
Besides desserts, The Sweet Dynasty also serves various signature dishes, snacks, congees and noodles, such as pork ribs with tangerine, fried chicken wings in fermented bean curd, steamed rice-roll with mushrooms and bamboo fungus, barbeque pork bun, Sweet Dynasty fried rice, chicken congee with bird nest and abalone, fermented bean curd pork trotters noodle soup, Sweet Dynasty congee, etc., and there are also frequent seasonal dishes. 
The Sweet Dynasty understands people’s cravings for food; hence, it is open till 2 am in the morning regardless of weekdays or weekends. Whenever you crave supper at night or desserts during the day, you can always come to The Sweet Dynasty to enjoy the sweetness of happiness.","2F,No. 197, Sec. 4, Zhongxiao E. Rd., Da'an Dist., Taipei City Taiwan, R.O.C",Zhongxiao Dunhua,https://www.travel.taipei/en/gourmet/details/710,
185,Meimen SJT 梅門食踐堂,"The dishes of “Meimen SJT” are prepared meticulously. Every dish has a story behind it, and every recipe is personally prepared by Master Li Feng-Shan, who makes use of seasonal ingredients.
 
 Adhering to the traditional ancient cooking method, and emphasizing yin and yang harmony and the functioning of the five elements, it is intended for easy digestion and body absorption. The only four seasonings used are salt, vinegar, soy sauce and sesame oil, completely presenting the original flavor of the raw ingredients; emphasizing healthy eating through delicacies.
 
 All dishes are named with a cause, and explained by kung fu experts at the scene, allowing customers to savor the delicacies, and let their thoughts carry them to higher levels.
Sun-Thu 11:00-22:00
Fri-Sat 11:00-22:30
Located in the European-style BELLAVITA, “Meimen SJT” fuses the classic with the fashionable, and presents the exquisite and profound history of Chinese dietary culture in a modern style, allowing you to span the barriers of time and space to enjoy the essence of ancient and modern cuisine.","B2, No. 28, Songren Rd., Xinyi Dist., Taipei City Taiwan, R.O.C",Taipei City Hall,https://www.travel.taipei/en/gourmet/details/715,
186,"Shanghai Court, Hyatt Hotel Taipei 臺北君悅酒店-雲錦中餐廳","The classic Shanghai cuisines are strongly promoted by Shanghai Court of Hyatt Hotel Taipei; and the chef’s best recommendations will be the ""Pot-sticker-like Bean Curd Sheet with Fried Duck and Wild Mushrooms” which uses fried duck and wild mushrooms as fillings to be wrapped by bean curd sheets and tastes both crispy and tender. The other creative dish ""Cabbage and Roasted Wheat Glutens Stuffed with Chopped Streaky Pork"" is also popular and admirable in Shanghai Court that even if the gourmand will praise it pretty highly.
Daily11:30-14:30；18:00-21:30","2F., No.2, Songshou Rd., Xinyi Dist., Taipei City Taiwan, R.O.C",Taipei 101/World Trade Center,https://www.travel.taipei/en/gourmet/details/724,
187,He Feng Restaurant 荷風中國菜,"Based on original recipes like famous Yunnan Style Pot Roasted Beef and homemade ingredients such as salted black beans and shrimp paste, He Feng Restaurant has been well balanced between tradition and healthy food trend in their menu. The owner of He Feng purchases their produce directly from the best farmers to ensure the quality, and selects healthy ingredient like the agave nectar to replace sugar in the Sweet and Sour Pork dish. The way that He Feng inspired the Chinese food makes itself an urban legend in the Taipei city!
Mon.-Sun./Holiday pm11:30-14:00；pm17:30-21:00","No.32, Lane 106, Sec. 3, Minquan E. Rd., Songshan Dist., Taipei City Taiwan, R.O.C",Zhongshan Junior High School,https://www.travel.taipei/en/gourmet/details/711,
188,The taste of the steppe: Mongolian Fire Pot 草原風蒙古火鍋,"Unlike the soup base of the Japanese or Taiwanese hot pots, our restaurant uses the authentic imperial soup base passed down from Genghis Khan (1162-1227). Made with dozens of natural plants and herbs, the Mongolian soup base combines health foods as well as savory and sweet foods. We offer both spicy and life-preserving hot pots. Although hot pots are also served individually to ensure hygiene, the method of serving is different from the shabu-shabu style of Japan. Along with premium meat and fresh seafood, the Mongolian hot pots are the best choices for reunions or dates. There is also an unlimited supply of hot coffee and cold drinks, floral and herbal tea and ice-cream. The store is located near the MRT Jiantan Station, making it easily accessible.
weekdays 11:30~14:30 17:00~24:00, 
weekend 11:30~22:30","No. 35, Hougang Street, Shilin Dist., Taipei City Taiwan, R.O.C",Jiantan,https://www.travel.taipei/en/gourmet/details/708,
189,"Chiou Hwa Seafood Restaurant, Gloria Prince Hotel 華泰王子大飯店九華樓","Opening Hours: 11:30AM-2:30PM every day (orders end at 2:30PM); 5:30PM-09:30PM (orders end at 9:30PM)
Gloria Sliced Duck (succulent Peking Duck with a crispy outer layer)","2/F, No. 369, Linsen North Rd., Zhongshan Dist., Taipei City Taiwan, R.O.C",Shuanglian,https://www.travel.taipei/en/gourmet/details/716,
190,DSR Japanese Restaurant 大車輪-火車壽司,"It serves sushi by train model, the interesting combination with foods and fun stated the first suchi train in Taiwan.
11:00 - 21:30 (Sun ~ Thu)
11:00 - 22:30 (Fri ~ Sat)
Holidays: New Year's Eve","No. 53, Emei St., Wanhua Dist., Taipei City Taiwan, R.O.C",Ximen,https://www.travel.taipei/en/gourmet/details/732,
191,Jio Fong Ji Beef Noodle 雲客來山西刀削麵館 (原名:九豐記牛肉麵),"The beef noodle soup base is made from beef bone, beef and beef stomach. There is also a variety of noodle dishes and side dishes at great value, including stewed eggs & seaweed, stewed bean curd, pig's ears... and more. They are all just NT$20. Beef noodles are best enjoyed with Taiwanese sauerkraut, which is complimentary. Our signature dishes include roast beef noodles, clear beef noodle soup, beef noodles without soup, and half-beef-tendon noodles, which are all within NT$100. There are also beef offal and roast beef tendon that are offered at good prices for you to enjoy.
Sun-Mon 11:30~20:30 (unannounced holidays twice a month)","No. 100, Sec. 1 Zhongxiao W. Rd., Zhongzheng Dist., Taipei City Taiwan, R.O.C",Beimen,https://www.travel.taipei/en/gourmet/details/705,
192,Ke Lao Ell Bakery 柯老二糕餅,"08:00-22:30, Monday to Saturday
09:00-22:00, Sundays
Along with the smart control of baking time, KLE can always provide great taste that spreads among people by word of mouth.
Stepping out of the Taipei Metro Kunyang Station and waling into the small alley behind, an aroma that no one can resist is coming from KLE.","421 Zhongxiao East Road, Section 6, Nangang Dist., Taipei City Taiwan, R.O.C",Kunyang,https://www.travel.taipei/en/gourmet/details/725,
193,Royal Yellow Beef Noodles 皇家黃牛肉麵,"Founded long ago on Boai Rd., Taipei City, Royal Yellow Beef Noodles is currently located on Qingdao E. Rd., and it is frequented by legislators and their aides while also drawing people even from around the world.
 
 The restaurant is best known for half-tendon, half-beef noodles, available braised or stewed. Something irresistible about this specialty is the gem-like luster of beef tendon, combined with chewy noodles and beef prepared with therapeutic Chinese herbs. The flavorful soup stock is either a milky extract from the femoral bones of beef cattle, or a spicily red one infused with Chinese herbs for a non-smelly, non-greasy taste. Chili peppers are available for extra spiciness.
 
 Serving beef noodles in a sanitary setting for 30-plus years, the owner of Royal Yellow Beef Noodles invites you to experience an unforgettable taste that embodies his dedication to a time-honored delicacy.
Daily 11:00~20:30; closed on Chinese New Year holidays","No. 9, Qingdao E. Rd., Zhongzheng Dist., Taipei City Taiwan, R.O.C",Shandao Temple,https://www.travel.taipei/en/gourmet/details/704,
194,China Pa 中國父音樂餐廳,18:00-03:00(Mon-Sun),"145,Sec.1,An-Ho Rd., Da'an Dist., Taipei City Taiwan, R.O.C",Nanjing Sanmin,https://www.travel.taipei/en/gourmet/details/719,
195,UPTOWN’S Pastry Shop 上城糕餅小舖,"The brown, wooden-textured interior gives UPTOWN’S Pastry Shop a distinctively European ambiance popular with office workers and housewives alike. The aroma of freshly baked bread and pastry-themed window dressing never fail to tempt passers-by.
 
 The founder of UPTOWN’S is Hong Quan-ping, a financial professional who received an MBA degree from Northwestern University, despite his long-time passion for culinary arts. As its English name suggests, the bakery is expected to deliver “natural, simple and tasty” baked goods.
 
 In addition to an award-winning pineapple cake, the must-tries include the uniquely chewy San Francisco Sourdough Bread (long-fermented with natural yeast), strawberry and cream cheese cakes, basil country bread (infused with vegetables and spices), and healthy Yutane bread stuffed with azuki bean paste. Take a look through the show window of UPTOWN’S, a symbol of inexplicable happiness, and you will wish you could have every delicacy it makes.
Daily 07:15-22:30","1F., No. 368, Fuxing N. Rd., Zhongshan Dist., Taipei City Taiwan, R.O.C",Zhongshan Junior High School,https://www.travel.taipei/en/gourmet/details/700,
196,Old Hsiung's Beef Noodle Soup 老熊牛肉麵店,"The proprietor of this popular beef noodle soup shop is a Sichuan native, so the house specialty is suitably spicy. Old Hsiung has taken a recipe heavy on chili and Sichuan peppers and modified it into a crowd-winning concoction without sacrificing any of the goodness of the original recipe. One of the must-try offerings on the menu is Sichuan style stewed beef needle soup. The broth is a bit spicy, and the noodles have a homemade taste of wheat. The lean beef cubes are from local Taiwan cows and packed with flavor. If you like hot, this is your spot.
Mon~Sat 11:00~20:00; Sun 11:00~15:00","No. 38-2, Nanhai Rd., Zhongzheng Dist., Taipei City Taiwan, R.O.C",Chiang Kai-Shek Memorial Hall,https://www.travel.taipei/en/gourmet/details/722,
197,Shanghai Longji Restaurant 上海隆記菜館,"Shanhai Longji Restaurant is one of the oldest Shanhai style Chinese restaurants in Taipei; for over half a century, Longji never changed their recipe or taste, even the Chef. This kind of Shanhai style cuisine was originated from small food stands behind the main streets, and Longji keeps this way of ""food stand"" until now. So there are 20 more appetizer style dishes available to choose in Longji’s food stand besides Longji’s main specialities like ""Pork-Seafood in Casserole"" and so on. So if you are looking for old fashioned Shanhai style cuisine, Longji will be the place.
Daily11:00-14:00；17:00-21:00","No.1, Lane 101, Yanping S. Rd., Zhongzheng Dist., Taipei City Taiwan, R.O.C",Ximen,https://www.travel.taipei/en/gourmet/details/706,
198,La Boheme Café 波西米亞人咖啡館,"Opened by an opera and classical music lover, La Boheme is as fastidious about music as it is about its coffee. Classical music flows through the café via a high-end sound system to deliver crystal clear sound to your table.
Daily am12:00-pm22:00","B1, No. 76, Chang-an W. Rd., Datong Dist., Taipei City Taiwan, R.O.C",Zhongshan,https://www.travel.taipei/en/gourmet/details/701,
199,King Join (已歇業) 京兆尹,"The cuisine concept of King Join is to serve a taste of royal dishes while using healthy ingredients. Though this is thought to be old-fashioned. It seems to attract young customers. Royal dishes are now for everyone, not just for nobles.
11:00~22:00","No. 18, Siwei Rd., Da'an Dist., Taipei City Taiwan, R.O.C",Daan,https://www.travel.taipei/en/gourmet/details/723,
200,1010 Hunan Cuisine (Fubei Store) 1010湘(復北店),"The feature of Pop Hunan Cuisine is using creative originality to give the traditional Hunan cuisine a different style and characteristic. The most famous dish is ""Fried Pork Ribs with Chili and Fennel Spices"", which has tender ribs of smooth taste with strong and pleasant fennel flavor. ""Steamed Fish Head with Green and Red Chili"" uses salted green and red chili to enhance the fresh, spicy, and delicious taste of chub. Those two delicious cuisines are specialties and popular in Pop Hunan Cuisine, and the thick and delicate flavor truly represent the traditional and essence of Hunan cuisines.
Daily中午11:30-14:30，晚上17:30-22:00","No.301, Fuxing N. Rd., Songshan Dist., Taipei City Taiwan, R.O.C",Zhongshan Junior High School,https://www.travel.taipei/en/gourmet/details/702,
201,Honglin Tappasaki & Piano Bar 鑫紅林鐵板燒,"Mon. - Sat. 17：30 - 22：00(供餐至21：00)
Sun.","B1, No.23-3, Shuangcheng Street, Zhongshan Dist., Taipei City Taiwan, R.O.C",Zhongshan Elementary School,https://www.travel.taipei/en/gourmet/details/744,
202,A-Cheng Beef Noodles 阿成牛肉麵,"The modernist storefront of A-Cheng Beef Noodles is always packed with loyal customers despite its limited space. Located near MRT Linguang Station, A-Cheng is highly accessible traffic-wise. It offers delicacies that meet various gastronomic preferences, such as the blandly stewed beef noodles and spicy braised/charcoal-grilled options, at a price under NT$ 100 per dish (except the NT$ 120 Manhan Beef Noodles).
 
 Handmade according to an ancient recipe, the chewy yet non-greasy noodles are dressed with a slightly spicy Chinese herbal soup containing tender beef/tendons. Visit A-Cheng for beef noodles that are the gourmands’ definition of excellent cuisine, and enjoy the exclusive side dishes.
Opening Hours: Mon-Fri 11:00AM-2:30PM; 4:30PM-9:00PM; Sat-Sun 11:00AM-9:00PM","No. 98, Fuyang St., Da'an Dist., Taipei City Taiwan, R.O.C",Linguang,https://www.travel.taipei/en/gourmet/details/726,
203,Su Chia Beef Noodle Shop 北投粟家牛肉麵,"This Beitou District eatery is well known for its Sichuan-style broth spiced with a chili soybean paste. Diners can choose from four other flavors as well, including original and tomato. The soup is made with Australian beef, beef tendon, and tripe for a dependably authentic and top-notch taste.
Daily 10:00 to 23:40","1F, No. 2, Sec. 1, Yongsing Rd., Beitou Dist., Taipei City Taiwan, R.O.C",Xinbeitou,https://www.travel.taipei/en/gourmet/details/734,
204,579 Sichuan-Style Beef Noodles 伍柒玖川味牛肉麵,10:30AM-10:00PM every day,"No. 245, Wuxing St., Xinyi Dist., Taipei City Taiwan, R.O.C",Taipei 101/World Trade Center,https://www.travel.taipei/en/gourmet/details/727,
