457,Bangka Park 艋舺公園,"Previously known as Park No. 12 located in the Wanhua District, the sprawling Bangka Park next to Longshan Temple is enclosed by Guangzhou St., Heping W. Rd., Sanshui St. and Xiyuan Rd. Developed by the Taipei City Government, it is a distinctively art-themed “folklore park” teeming with culturally significant details. For example, a dragon-inspired sculpture in the Park’s east side is inspired by a Chinese Feng Shui rule for good luck, being an azure dragon appearing on the left-hand side when facing south, while a boat sculpture in the west side recount a bit of history of the early settlers in the neighborhood who used canoes as a common means of transportation, ferrying and trade. Adjacent to a pond named “Beauty’s Mirror” is a viewing platform defined by Feng Shui principles in accordance with the position of the Big Dipper constellation, where illuminated “dancing water” shows are staged on a daily basis. After sunset, the Temple Gateway Square, an extension of the Longshan Temple into the Park’s north side, sees over 2,000 stars simultaneously radiating lights of varying colors from an astrological chart that consists of both Chinese and Western zodiac signs. Meanwhile, the roof tile-like structure of reinforced glass and vitreous enamel panels transforms the Park’s inverted U-shaped art gallery into a passageway with recreation and exhibition facilities. As an important public project in the City Government’s campaign of “Rotating the Axis of Urban Development and Regenerating Taipei West”, Bangka Park, along with its neighboring Longshan Temple, will hopefully blossom into a vibrant international tourist hotspot of historical, cultural and religious importance that buttresses western Taipei’s growth and business potential, and ultimately regains the glory of this two-century-old neighborhood.
Open all day","Opposite Longshan Temple, Wanhua Dist., Taipei City Taiwan, R.O.C",Longshan Temple,https://www.travel.taipei/en/attraction/details/603,
458,Sugar Refinery Cultural Park 糖廍文化園區,,"No.132-10, Dali St., Wanhua Dist., Taipei City Taiwan, R.O.C",Longshan Temple,https://www.travel.taipei/en/attraction/details/565,
459,LOVE: Love in Taipei City; Love in Taiwan LOVE 台北之愛 台灣之愛,"On the commercial tower’s front square, where global business professionals shuttle back and forth, the universal language of LOVE tears down cultural, racial and national barriers to conjure up visions of peace and prosperity.
By Robert Indiana
Materials: Aluminum, paint, iron (mount)
Source: “Taiwan Public Art” website (http://publicart.moc.gov.tw/eng/)","On the square in front of No. 45, Shifu Road, Xinyi Dist., Taipei City Taiwan, R.O.C",Taipei 101/World Trade Center,https://www.travel.taipei/en/attraction/details/640,
460,XUE XUE 學學,"The Neihu-based XUE XUE INSTITUTE regularly offers an array of lectures on arts, culture and lifestyle that range from hands-on programs to related conceptual projectss, allowing those interested in taking culture-oriented learning programs to their liking. In the modernist spatial design of Xue Xue Stage on the ground floor, performances and exhibits are curated according to three core concepts: creativity, culture and aesthetics. After a lecture or a show, visitors can enjoy meals at the riverside-park-facing ECOH ECOH XUE Kitchen Lab on the second floor, where the cozy wooden furniture offers a dose of tranquility in downtown Taipei. The arts-filled XUE XUE INSTITUTE demonstrates Taipei’s and Taiwan’s capacity for renovation and creativity through a creative combination of current trends, lifestyle, arts, music and exhibitions.
Mon.-Sun. 10 AM-7:30 PM","No. 207, Sec. 2, Tiding Blvd., Neihu Dist., Taipei City Taiwan, R.O.C",Xihu,https://www.travel.taipei/en/attraction/details/610,
461,Tamsui Old Street 淡水老街,,"Zhongjheng Road, Tamsui Dist., New Taipei City Taiwan, R.O.C",Tamsui,https://www.travel.taipei/en/attraction/details/659,
462,"Deity, Time 女武神，時間廊","The public art project “Deity, Time” is a 7-meter-tall martial goddess erected on the median island by the Civic Blvd. and Dunhua N. Rd. intersection. The awe-inspiring, horse-riding deity is a stark contrast to an adjacent iron cage labeled as “time gallery”, which refers to the time lag that exists in all the beautiful memories. While everything is governed by time, specific moments are frozen in the time gallery. Dawn Chen-Ping, a fine arts professor from Taipei National University of the Arts created “Deity, Time” in hopes of adding variety to the cold triangle of median islands with art works. He has delivered “Convoluted and Look-Through”, “Cavalleria Rusticana” and various other art installations since the government vowed to turn Taipei into an art-filled city in a 2003 public art program.
Public art project
Urban open space","Intersection of Civic Blvd. and Dunhua N. Rd., Da'an Dist., Taipei City Taiwan, R.O.C",Zhongxiao Dunhua,https://www.travel.taipei/en/attraction/details/573,
463,Yifangju Estate 義芳居古厝,"Class 3 Historic Site
 Type: Residence
 Built in the 2nd Year of Emperor Guangxu (1876 AD)
 
 Yifangju Estate was built by the early settlers of the Chen family. The Chen family’s ancestors came from Anxi County, Quanzhoufu of Fujian Province. During the Qianlong era of the Qing Dynasty, the early Chen members traveled to Taiwan as pioneers. It wasn’t until the early Guangxu era that they invested a huge sum of money to construct the Yifangju Estate. This traditional sanheyuan (a three-section compound) was typical of the ancient residences of the Taipei basin area. The main hall was constructed in a U-shape design; the walls of the main hall and ancillary halls (to the left and right of the main hall) were built with bricks, and few windows and doors were present. In addition, a firearms cabinet was built on the second floor of the ancillary halls to guard the residence against robbers. Furthermore, most of the window frames were made with rocks produced in Taipei. The door plate of the residence indicated that it was constructed around the 2nd year of Emperor Guangxu. Due to the rapid modernization of Taipei City, traditional residences like Yifangju Estate continue to dwindle in number. It is important that those that remain are preserved as testimony of Taipei’s development history.","No. 128, Lane 155, Sec. 3, Keelung Rd., Da'an Dist., Taipei City Taiwan, R.O.C",,https://www.travel.taipei/en/attraction/details/577,
464,Taipei National University of the Arts 臺北藝術大學,"The wall-less Taipei National University of the Arts (TNUA) atop Mt. Guandu commands a panoramic view of the Guandu Plain. It is a complex of unique school buildings with red bricks, gray walls, black roof tiles and decorative lines that stretch along the mountain slope, where patches of grassland, meandering foot paths and a multitude of installation arts merge into a unique architectural style. Not only are the on-campus Paulaner or DAVINCI restaurants perfect for nightscape viewing, it also affords a fantastic view of every corner of the campus, from classrooms, art galleries to the auditorium. It showcases how arts are interwoven with everyday life. Also worth exploring are the decorative installation arts.","No. 1, Xueyuan Rd., Beitou Dist., Taipei City Taiwan, R.O.C",Zhongyi,https://www.travel.taipei/en/attraction/details/611,
465,The Garden 鳥籠外的花園,"Installed on a median island, “Garden” is a highly intriguing project that features a healthy tree confined in a cage, with bars spaced too far apart to get hold of a bird. “Garden” was constructed out of stainless steel tubes and glass fiber by May Hsu, a Taiwan-based visual artist and illustrator who had graduated from Parsons, the New School for Design. Hoping to bring peace of mind to a bustling urban spot, she erected this urban garden as a symbol of spiritual tranquility, nestled among trees lining the green boulevard that defined Dunhua S. Road’s beautiful streetscape.","Intersection of Dunhua S. Rd. and Anhe Rd., Da'an Dist., Taipei City Taiwan, R.O.C",Zhongxiao Dunhua,https://www.travel.taipei/en/attraction/details/575,
466,"Museum of Medical Humanities, NTU 臺大醫學人文博物館","The earliest building of the Museum of Medical Humanities, initially belonging to the medical school of Taihoku Imperial University, was completed in 1907 by Kondo Juro under the Japanese colonial rule. The century-old main structure was unveiled later in 1913 and is largely still preserved today, thanks to frequent restoration efforts. Initially used to house classrooms and an administrative center, the main structure grew into a national hub of medical research, a fortress of medical education reform, a site of medical humanities education and, in 2008, a museum. In addition to permanent exhibits such as “A New Born”, “The Peopling of Taiwan” and “Taiwanese People’s Struggle against Diseases”, the Museum offers special exhibits every six months to explore the impact of medical studies. It also displays exhibit items at medical education institutions nationwide. In the style of the later French Renaissance, the stately museum features graceful curves and carvings in the lobby, on the main wall and columns, with arched designs sumptuously used in the lobby and hallways for extra elegance. Unfortunately, a fire broke out in 1930 and destroyed the Mansard-style, slanted roof with slates, bronze and a little round window on top of it.
 
 Front entrance
 The west wing was first constructed in 1907
 The semi-outdoor corridor in the south wing, photographed by Jack M. S. Hsu
 The restored rooftop in 1997, photographed by Jack M. S. Hsu
 The indoor hallway of north wing
 The restored lobby","No. 1, Sec.1, Renai Rd., Zhongzheng Dist., Taipei City Taiwan, R.O.C",NTU Hospital,https://www.travel.taipei/en/attraction/details/567,
467,The Koo’s Dadaocheng Residence 大稻埕辜宅,"Koo’s Salt House was built in 1910 by Koo Hsien-jung, the father of Koo Chen-fu, former chairman of Straits Exchange Foundation. It used to be the Koo’s riverside residence in Dadaocheng and received its name from the salt business that the family was running. Designed to situated face the Tamsui Wharf, the house allowed shipping boats to be moored right in front of it.
 
 Two years after the Koos moved out of the house in 1961, the Rongxing Kindergarten was opened on the site. Unique even by today’s standards, this late-Renaissance structure shows signs of Western influence on the luxury estates at the time, such as the arched hallway, the façade that featured the pale yellow tiles, and the gracefully arched windows. Inside the house, the frequent use of Chinese cypress in well preserved ceiling and stairs, along with a wall marked with the logo of Koo Hsien-jung’s Dahe Trading Company. All these designs bear witness to the family's heyday as well as a highlight in the city’s history.","No. 9, Lane 303, Guisui St., Datong Dist., Taipei City Taiwan, R.O.C",Daqiaotou,https://www.travel.taipei/en/attraction/details/570,
468,Tamsui Fisherman's Wharf 淡水漁人碼頭,,", Tamsui Dist., New Taipei City Taiwan, R.O.C",,https://www.travel.taipei/en/attraction/details/665,
469,Huajiang Wild Duck Nature Park 華江雁鴨自然公園,"The vast stretch of sandbars and wetlands near Huajiang Bridge has long been a habitat for various migratory birds, attracting thousands of species of the Anatidae, Scolopacidae and Charadriidae families from September through April. The park is divided into a Core Zone, a Buffer Zone and a Sustainable Utilization Zone, according to the type of ecological resources, in an effort to preserve and protect the natural environment with the fauna/flora habitats intact. Inaccessible to the general public, the Core Zone is a major wetland restoration site largely dedicated to the restoration and maintenance of bird habitats. The educationally-functional Buffer Zone separates the Sustainable Utilization Zone and Core Zone with hedgerows or blockade ditches; it consists of freshwater ponds, tidal ponds, aquatic plants and marsh plants, each representing a distinctive eco-system. Growing among the artificially planned and cultivated park turfs are many herbaceous and woody plants that insects feed on, while the sizeable population of invertebrates on mudflats and shoals offer perfect food for Scolopacidae and Charadriidae. Primarily designed for family recreation and bird watchers, the Sustainable Utilization Zone is installed with a duck-watching trail, a bird observatory square and a family-friendly zone, where people can enjoy outdoor activities with relatively little environmental impact. To further promote ecological education, large-scale duck- and goose-watching events are hosted in the park during the migratory-bird season, with guided tours available on weekends/holidays. The Huajiang Wild Duck Nature Park, which lies beyond the embankment, and Huazhong Riverside Park, are perfect for wild bird watching; their comprehensive facilities ensure easy observation of the fascinating eco-systems.
Open 24 hours a day","Located west of Huajiang Bridge, Wanhua Dist., Taipei City Taiwan, R.O.C",Longshan Temple,https://www.travel.taipei/en/attraction/details/630,
470,Peaceful and Content (Ru-Yu-De-Shui) 如魚得水,"Located at the intersection of Dunhua N. Road and Nanjing E. Road, “Peaceful and Content” is a marble sculpture that measures at 250 cm in length, 60 cm in width and 180 cm in height. It resembles the shape of a fish enveloped in river- or sea-water and adorned with layers of wave-like stripes, creating an incredible illusion of motion as if it were swimming ahead with ease. Some gaps in the marble create a space where the tangible mixes with the intangible, to offer a thought-provoking metaphor for the relationship between fish and water.
 
 Lin Chin-Tsung , who created “Peaceful and Content”, is a Hualien resident with inexhaustible passion for the art of stone carving. He is impressed by how the naturally occurring Hualien marble comes in varying hues with natural bands of colors, and how water erosion gives it widely distinctive shapes ranging from clouds in the sky to adorable animals on land. As a result, he started using marble to create artworks that are one of a kind. His renowned projects include: “A Fish-Shaped Landscape”, which was erected in front of the Hualien County Government building, “Fish” in the Xiao Yehliu National Scenic Area, Taitung, and “Peaceful and Content” at the intersection of Dunhua-Nanjing Roads.
Public open space
Note: the sculpture is located at the intersection of Dunhua N. Road and Nanjing E. Road in Songshan Dist., Taipei City.","Dunhua North Rd., Songshan Dist., Taipei City Taiwan, R.O.C",Taipei Arena,https://www.travel.taipei/en/attraction/details/551,
471,Erziping Trail 二子坪步道,"Located between the main peak of Mt. Datun and Mt. Erzi, the approximately 2-kilometer long Erziping Trail was built along a volcano-tectonic depression in Yangmingshan and ranked as the country’s top 10 scenic trails, rivaling those in the Alishan and Taroko Gorge. Thanks to its evenly paved surface and pleasant weather, this wide, barrier-free footpath is the most accessible one in Yangmingshan National Park. In addition to three ponds, scenic highlights and the balmy weather thanks to its location in the lee side of Mt. Datun, the Erziping Trail Recreation Area spans the subtropical and warm temperate zones, making it virtually Nature’s classroom with impressively diverse vegetation ranging from forest trees (mostly Red Nanmu, Japanese Black Pine and Chinese Sweet Gum), arborescent plants, shrubs and ferns of all kinds, to food plants for butterflies, nectar-yielding plants and aquatic plants. It is perfect for a casual stroll and also for such activities as butterfly- and bird-watching, mountaineering, hiking, sightseeing, day-tripping and flora observation.
Visitor Center opens Mon.-Sat. 8 AM-6 PM; weekends 9 AM-4:30 PM","No. 1-20, Zhuzihu Rd., Yangmingshan, Sanzhi Dist., New Taipei City Taiwan, R.O.C",,https://www.travel.taipei/en/attraction/details/604,
472,Academia Historica 國史館,"Academia Historica is located on Changsha St. behind the Office of the President. The building is a fusion of western classic and modern styles, and designated as a municipal historic site. In the early years, it was the site of the Communications Bureau, Transportation Department of the Taiwan Governor-General’s Office during the Japanese Colonial Period. In October, 2010, the museum hosted the “Artifacts Exhibition of the Presidents and Vice Presidents” to display themes and historic relics inspired by the Presidents and Vice Presidents, and also diplomatic gifts and tokens from countries around the world. In addition to scheduled tours and group tours by appointment, the museum also holds promotional and educational activities in conjunction with the exhibitions, including a series of lectures and keynote speeches on historic relics. In addition, the museum provides digitized files of its collection for search and application by all sectors.
Mon. to Fri. 9:30 AM~4:30 PM
Also open on dates during which the Office of the President is open to visits on holidays","No.2, Sec. 1, Changsha St., Zhongzheng Dist., Taipei City Taiwan, R.O.C",Ximen,https://www.travel.taipei/en/attraction/details/624,
473,Xinyi Shopping District 信義商圈,"Known as the ""Manhattan of Taipei,"" the Xinyi Shopping District brings together upscale malls, Eslite Bookstore, cinemas and all manner of international cuisine. This is also a great spot to enjoy the evening view and pulse of Taipei.
around 11:00~21:30","Songzhi Road, Songren Road, and Xinyi Road, Xinyi Dist., Taipei City Taiwan, R.O.C",Taipei 101/World Trade Center,https://www.travel.taipei/en/attraction/details/1695,
474,Shih Chien University 實踐大學,"The minimalist buildings of Shih Chien University (SCU) were completed using the emerging “exposed concrete surface method” that primarily leaves concrete structures unpainted and un-tiled after the casting mold is removed, to preserve the natural texture of the construction materials (bare concrete, exposed aggregate, steel, glass and metals) in a harmonious architectural fashion. The method, using bare concrete is as the main material, has been applied to the Tung-Min Memorial Hall that houses the College of Design, the revamped Library and Information Building, and the new Sport Center. Students from the Department of Fashion Design, an academic highlight of SCU, are able to freely present their works in multiple venues around the department building, such as the stairwells, bathrooms, or anywhere else they please, in pursuit of their creative vision.","No. 70, Dazhi St., Zhongshan Dist., Taipei City Taiwan, R.O.C",Dazhi,https://www.travel.taipei/en/attraction/details/612,
475,Yingfeng Riverside Park 迎風河濱公園,"Situated on the stretch along the Keelung River bank between Dazhi Bridge and National Freeway 1, the 67-hectare Yingfeng Riverside Park was completed in 2002; it includes facilities to accommodate skating, softball, soccer, baseball, woodball and miniature golf. It is a comprehensively equipped sports park where many international sporting events take place. A major highlight of the Riverside Park’s Jintai section is the country’s first leash-free sports park for dogs; it measures at approximately 1 hectare in area and contains two parts, one for big canines and the other for smaller ones. With a stainless steel fence around the perimeters and double doors that protect both dogs and people, dog-waste removers, 8 benches and 4 wash basins, this special-purpose park is fantastic for family recreation and also for dog lovers to spend some fun time with their beloved pets.","Watergate No. 7, Binjiang St., Songshan Dist., Taipei City Taiwan, R.O.C",,https://www.travel.taipei/en/attraction/details/601,
476,Youth Park 青年公園,,"No. 199, Shuiyuan Road, Wanhua Dist., Taipei City Taiwan, R.O.C",,https://www.travel.taipei/en/attraction/details/635,
477,Beitou Park Outdoor Hot Spring Bathing Pool 北投公園露天溫泉浴池,"To visit the open-air hot spring pools in Beitou Park, just walk from the parking entrance toward Thermal Valley, and they are only a 15-minute walk.
 
 The park was only opened in late 1999, on the eve of the new millennium, and is therefore also known as the ""Millennium Hot Spring."" The pools occupy roughly 1,000 square meters, and the area features a Japanese-style architectural design employing mostly natural materials such as stone and wood. The roof of the ticket booth and bathhouse consist of curved black tiles, which add to the classic Japanese atmosphere.
 
 The hot spring water in the park comes from Thermal Valley, and is derived from so-called green sulfur springs. The six public pools are located at different heights reflecting the sloping topography; four are hot pools, and two are cold pools. The temperature of the hot springs water varies between 38°C and 42°C, and decreases progressively as one goes downhill. This system allows bathers to select a hot spring pool with the temperature that suits them best.
 
 One benefit of bathing in an outdoor pool is that you can enjoy the gentle breeze, the pleasant sounds of nature, and the park's lush greenery as you soak. If you choose to bathe at night, the bright moon and countless stars will accompany you as you soak away the weariness and stress of urban life.
 
 It should be noted that, in order to maintain the cleanliness and safety of the pools and the surrounding environment, visitors must wear swimsuits when bathing, and must uphold bathing rules. The pools are open for six periods every day, and first open at 5:30 in the morning. Please visit the park's website for detailed bathing hours and other relevant information.
 
 Do you enjoy outdoor hot springs bathing? Why not have a soak at the Beitou Park Outdoor Hot Spring Pool!",", Beitou Dist., Taipei City Taiwan, R.O.C",Xinbeitou,https://www.travel.taipei/en/attraction/details/713,
478,Ximending 西門町,"Ximenting is the mecca for youth culture. From tatton street to Wannian Plaza accessory shops, cosplay to street dancing, Ximenting offers a venue for youths to express themselves. Pop stars often come here for promotional events on weekends.","Zhonghua Rd., Wanhua Dist., Taipei City Taiwan, R.O.C",Sanchong,https://www.travel.taipei/en/attraction/details/1694,
479,"A Visual Journey of Discovery of Taipei City, Then and Now 意在臺北","Taipei city wall was completed in 1884 at the time of the Sino-French War. Provincial Inspector-General Liu Ming-chuan came to Taiwan to oversee military and political administration and based himself in Taipei Walled City, where he supervised the building of government offices and schools, the laying of a railway, and opening of postal and telegram service in the city, laying down the foundation for its later development. After the Japanese gained control of Taiwan in 1895, Taipei City had its ups and downs and, from Retrocession in 1945 on, gradually become prosperous and the most important city in Taiwan.
 The four sculptures were inspired by the people of past and present including Liu Ming-chuan, and planning, and provide a view of the development of Taipei Walled City. The streets of the walled city are carved into a relief sculpture showing the simple and beautiful landscape of the past.
 It is well worth looking closely at the history of Taipei, our city.
 Design explanation:
 Creative and amusing figures from the past and present are sculpted, they interact and contemplate the City Relief Sculpture.
 
 Bronze sculpture:
 Liu Ming-chuan (132cm, sitting), with a coffee cup in hand, talking to people from today about Taipei City while he drinks.
 Designer: (175cm, standing), city planner, standing on the street talking with Liu Ming-chuan
 Young couple (168cm, standing), leisurely taking a selfie with city relief sculpture as the background.
 City Relief Sculpture: (300cm*300cm): Based on the 1895 Outline Map of Taipei City, Dadaocheng and Mongka
 Design and production: Wang Zhi-wen
  
All the day","In front of Exit No.1 square of the MRT Ximen station; intersection of Zhonghua Road and Chengdu Road., Wanhua Dist., Taipei City Taiwan, R.O.C",Ximen,https://www.travel.taipei/en/attraction/details/636,
